Название вакансии,URL,Название комании,Описание
Data Science Team Lead,https://sergievposad.hh.ru/vacancy/30821952?query=python, Офисная вакансия Yum! Brands,"...and mentor for effective, deep research. Lead development and maintain coding best practices. Hands on research and implementation, in Python.Knowledge of JAVA, J2EE, JavaScript, JSON, Python, SQL, and PL/SQL a plus. Basic understanding of project lifecycle..."
Data Scientist,https://sergievposad.hh.ru/vacancy/31552816?query=python, Ipsos Comcon,"Разрабатывать алгоритмы анализа неструктурированных данных (публикации из социальных медиа, открытые вопросы анкет, фото и видео контента). Писать скрипты для парсинга...Хороший уровень математической подготовки (теории вероятности и мат.статистики, методов прогнозирования и т.п.). Опытного программиста на Python в сфере анализа..."
DevOps Engineer,https://sergievposad.hh.ru/vacancy/31788511?query=python, inDriver,"Непосредственно управлять всей IT инфраструктурой бэкенда. Планировать эксплуатацию. Обеспечивать бесперебойность, безопасность и быстродействие сервисов. Реагировать на инциденты. Взаимодействовать с командами...Опыт проектирования и ввода в строй системы по повышению производительности и надежности для СУБД. Опыт разработки на Golang, Python."
Ведущий DevOps-инженер,https://sergievposad.hh.ru/vacancy/31419991?query=python,ООО БОСТОНДЖИН,"Построение и поддержка окружений разработки, тестирования и промышленной эксплуатации инфраструктуры облачной платформы BostonGene. Автоматизация CI/CD. Поддержка кластерных окружений, тестирование...Высшее техническое образование. Опыт в программировании (на одном из языков - Python, Bash, Ruby) от 1 года. Опыт администрирования серверов на..."
Специалист по проведению тестов на проникновение/анализу защищенности,https://sergievposad.hh.ru/vacancy/24226263?query=python, Group-IB,"Анализ защищенности веб-приложений (с анализом исходных кодов, без исходных кодов). Участие в проведении тестов на проникновение. Оформление результатов своей...Опыт работы специалистом по анализу защищенности/пентестером. Опыт поиска уязвимостей, основные скриптовые языки: PHP, Java, Python, Ruby, Perl."
Data Scientist,https://sergievposad.hh.ru/vacancy/30758276?query=python,ООО Строительный Двор,"анализ поведения клиентов с использованием методов машинного обучения для формирования целевых предложений для них. - анализ поведения клиентов на сайтах с...высшее образование. -опыт решения задач машинного обучения с использованием языков Python или R. -знание математических методов, используемых для решения задач..."
Программист C++,https://sergievposad.hh.ru/vacancy/31917138?query=python, ФГУП ГосНИИАС,"Разработка десктопных/серверных приложений. Программирование, внедрение и поддержка разрабатываемых решений. Профилирование, оптимизация производительности и использования ресурсов. Документирование кода и создание...Опыт создания многопоточных приложений, включая серверные. Желательно знание скриптовых языков: Python. Умение разбираться в чужом коде и использовать чужие наработки. "
Product Owner в команду Booking & Billing,https://sergievposad.hh.ru/vacancy/31919036?query=python, BestDoctor,"Booking experience. Улучшать процесс записи наших пациентов к врачу, а также покупки дополнительных медицинских услуг. Влияние этой команды начинается с...Умеет и хочет быть самостоятельным в своей работе, а также ответственно подходит к задаче, которую делает. Отлично знает принципы мобильной..."
Spice Simulator – Compact Models Developer,https://sergievposad.hh.ru/vacancy/31429016?query=python," Silvaco, Inc","Development and QA of semiconductor compact models in Verilog-A. Maintenance of an established base of compact models. ...especially Verilog-AMS, and with ADMS Verilog-A to C converter. Experience with scripting languages, such as Perl or Python."
Back-end разработчик,https://sergievposad.hh.ru/vacancy/31504620?query=python, Ред Машин,"Разработка backend для B2B SaaS. Разработка масштабируемых высоконагруженных решений. Оптимизация существующих систем.Опыт разработки на Python. Знание Django, Flask. Linux advanced user. Опыт работы с Redis, Celery, PostgreSQL. Умение пользоваться Git. "
Data scientist /Quantitive Analyst,https://sergievposad.hh.ru/vacancy/31472536?query=python, Сбербанк для экспертов,"Вы будете участвовать в проектах по развитию риск-метрик для управления процентным и валютным риском, а также риском ликвидности. Сертификаты CFA, FRM и аналоги будут преимуществом. Диплом РЭШ будет преимуществом. Python, SQL. Желание развиваться в риск-менеджменте."
"Младший разработчик веб-скрейперов (Python, Selenium)",https://sergievposad.hh.ru/vacancy/31240024?query=python, Институт прикладных экономических исследований РАНХиГС при Президенте Российской Федерации,"Сбором и анализом данных из разнообразных источников. Построением отраслевых и межотраслевых экономических моделей. Разработкой и сопровождением экономических информационных систем. Пакета Selenium. Языка программирования Python. Языка запросов SQL и принципов организации реляционных СУБД. Основ JavaScript, DOM, HTML, CSS, XPath. "
Младший компьютерный лингвист (Python),https://sergievposad.hh.ru/vacancy/31240083?query=python, Институт прикладных экономических исследований РАНХиГС при Президенте Российской Федерации,Разработкой и сопровождением экономических информационных систем. Программирование машинно-лингвистических приложений на языке Python. Обработка больших массивов данных с использованием технологий...Языка программирования Python. Технологий и принципов машинной лингвистики и машинного обучения. Операционной системы Linux. Основ информационной безопасности. Знакомство с лингвистическими...
Ведущий разработчик middleware (Go / Python...),https://sergievposad.hh.ru/vacancy/31901283?query=python,АО Эрвиай Групп,"Управление и диспетчеризация взаимодействия вычислительных модулей. Преобразование интерфейсов, обеспечение Web и REST инфраструктуры. Работа с базой данных и очередями событий.Навыки работы с базами данных. Docker. Знание других языков (С/C++, Go, Python, Java, C#, Node.js и тд). "
Search Engineer,https://sergievposad.hh.ru/vacancy/31625861?query=python, Gshopper,As an engineer you will build out our AI operation centre. Operation centre must serve all automation tasks that our...Technologies and Skills. Experienced in writing data processing code (pipes or python or java or C++). Experience with Natural Language...
QA-инженер (Python),https://sergievposad.hh.ru/vacancy/30445725?query=python,ООО «Баланс-Платформа»,Покрытие автоматическими тестами на Python новых функций после ручного тестирования. Составление и поддержание актуальности тестовой документации. Определение процента покрытия тестами...Знаете Selenium и работали с системами CI. Имеете опыт разработки функциональных автоматизированных тестов на Python. Сможете составить тестовую документацию.
Вирусный аналитик/реверс-инженер (reverse engineer),https://sergievposad.hh.ru/vacancy/31550051?query=python,АО АСТ,Анализировать безопасность протоколов и программного обеспечения. Разрабатывать средства проверки защищенности и концептов имитации атак. Разрабатывать программное обеспечение на C/C++. Опыт разработки концептов и прототипирование на Python. Знание assembler x86/64. Приветствуется опыт анализа уязвимостей программного обеспечения и исследование...
Web аналитик (Python),https://sergievposad.hh.ru/vacancy/31791516?query=python, Performance food,"Построить и поддерживать систему сквозной аналитики, автоматизировать сбор данных и формировать отчеты в необходимых разрезах. Выстроить систему регулярной отчетности по...Понимание принципов A/B тестирования сайта и приложений. Хорошие знания Python. Знание хотя бы на базовом уровне SQL, умение самостоятельно..."
Data scientist - аналитик данных (CRM),https://sergievposad.hh.ru/vacancy/31910122?query=python,ПАО БАНК УРАЛСИБ,"Самостоятельное ведение аналитических проектов на всех стадиях: работа с заказчиком, формализация целей, сбор данных, создание моделей, внедрение в продакшн кейс...Знание статистики, эконометрики, машинного обучения, базз данных. R / Python (numpy, scipy, pandas, scikit-learn), Oracle SQL. Умение анализировать большие обьемы..."
Python-разработчик (Rambler Digital Solutions),https://sergievposad.hh.ru/vacancy/31079678?query=python, Rambler Group,"Продумыванием и разработкой архитектуры. Оптимизацией производительности приложений. Анализом и улучшением архитектуры кода. Поддержкой общепринятых практик контроля качества кода. Опыт программирования на Python3, Java Script, Kotlin. Опыт работы с фреймворками: Flask/Django/aiohttp/Tornado. Опыт работы с MongoDB..."
Аналитик Big Data,https://sergievposad.hh.ru/vacancy/30839241?query=python, Неофлекс,"Участие в консалтинговых проектах: Аудит решений (DWH, аналитические решения) клиентов. Анализ требований. Подготовка и согласование BRD и FSD. ...индустриальный опыт очень приветствуется. Наличие Сертификата Cloudera Certified Data Analyst. Знание основ алгоритмизации и понимание кода на Java/Scala, Python."
Senior Vue.js Front-end Developer,https://sergievposad.hh.ru/vacancy/31867197?query=python, YCLIENTS LLC,"Писать качественный, легко поддерживаемый и тестируемый код в команде опытных разработчиков. Писать тесты на него. Проводить code-review вместе с...Отлично знает JavaScript (es.next), TypeScript. Имеет обширный опыт работы с Vue.js. Умеет качественно верстать по mobile-first. Понимает как отлаживать..."
Big Data Engineer,https://sergievposad.hh.ru/vacancy/31861091?query=python, DWI Consulting,"Integration between Big Data and Oracle components (e.g. ODI). Management of Hadoop cluster, with all included services Ability to...System configuration health checks. Java/Python/Perl development skills in Big Data environment is welcomed. Datawarehouse concepts knowledge is a..."
Junior Data scientist/ риск Аналитик,https://sergievposad.hh.ru/vacancy/31864242?query=python,ООО МФК Займ Онлайн,"Создание и поддержание отчетов в актуальном состоянии. Построение, поддержание в актуальном состоянии и анализ качества скоринговых моделей. Анализ отклонений от...Владением одним или несколькими программами (R, Knime, Python). Знание основ теории вероятности, математической статистики, методов анализа данных и машинного обучения. "
QA Automation Lead,https://sergievposad.hh.ru/vacancy/31725997?query=python, Voximplant,"В автоматизации тестировании разнообразных API, SDK. Тестирования мобильных приложений. Создание универсальной платформы для автоматизации тестирования сервиса Voximplant. Формирование QA команды. Знание необходимого инструментария для тестирования как веб-сервисов, так и непосредственно веб-страниц и мобильных приложений. Опыт разработки на python..."
Product Owner в команду Medical Services,https://sergievposad.hh.ru/vacancy/31919047?query=python, BestDoctor,"Дизайн медицинской программы, обеспечение гибкости и настройки по наполнению и ограничениям. Органичное внедрение телемедицины в процессы обращения по страховым случаям...Разбирается в процессе разработки. Можешь быстро вайфремить в Realtimeboard. Знаешь SQL/Python. Понимаешь принципы мобильной разработки. Разбираешься в медицинском страховании..."
DevOps инженер (отдел корпоративной интеграции),https://sergievposad.hh.ru/vacancy/31236414?query=python, Dialog,"Сопровождать текущую инфраструктуру проектов. Настраивать и сопровождать кластеры в OpenShift. Администрировать кластеры PostgreSQL. Автоматизировать администрирование (Ansible). Организовывать и развивать систему...Опыт работы с инструментами DevOps: Git, Jenkins, Ansible или их аналогами и понимание этапов DevOps – CI, CD. Python / bash - для..."
HPC/DL Performance Testing Engineer,https://sergievposad.hh.ru/vacancy/31884782?query=python, NVIDIA,"You will develop software to automate the testing of DL-focused applications. You will configure computer systems with appropriate hardware...Excellent programming and debugging skills in a scripting language such as Perl, Python or Unix shell. Expertise in Perl programming..."
Data engineer,https://sergievposad.hh.ru/vacancy/30313957?query=python, Lamoda,"Design and build next generation best on market e-commerce data platform. Build and maintain reliable and scalable enterprise level...Knowledge of version control systems (git). Experience in Python is a huge plus. Strong understanding of RDBMS, SQL. "
Frontend-разработчик,https://sergievposad.hh.ru/vacancy/31917125?query=python, DSSL,"Разработка и поддержка сервиса облачного видеонаблюдения. Разработка модулей нового функционала. Решение интересных архитектурных задач. Проведение code review. Рефакторинг и оптимизация...Опыт разработки на JavaScript и Python, базовые знания SQL. Знание паттернов ООП. Умение верстать (HTML, CSS). Опыт работы с React.js..."
Программист C/C++,https://sergievposad.hh.ru/vacancy/31420166?query=python,АО Воентелеком,"Разработка серверной части системы на С/C++ под Linux. Разработка независимых модулей для серверной части системы. Изучение и внедрение новых......опыт разработки GUI (QT), web-интерфейсов. Желателен опыт работы с SQL и No-SQL БД. Желателен опыт разработки на Python."
Python-разработчик в отдел облачной инфраструктуры,https://sergievposad.hh.ru/vacancy/28538769?query=python, Rambler Group,"Разработка и поддержка системы управления облачными ресурсами. Автоматизация процессов, связанных с жизненным циклом компонентов инфраструктуры.Базовые знания современных стандартов HTML, CSS, Javascript. Опыт работы с фреймворками: Django/Flask. Работа с SQL(PostgreSQL) и NoSQL(Redis..."
Специалист технической поддержки и тестирования,https://sergievposad.hh.ru/vacancy/31558368?query=python, Tevian (ООО Технологии видеоанализа),"Развертывание, сопровождение и техническая поддержка продуктов — общение с интеграторами/заказчиками, воспроизведение и уточнение технических проблем, взаимодействие с командой разработки. Базовые знания языков программирования С/С++, Python. Опыт разработки на Windows и Linux платформах. Хорошее представление об устройстве сети и..."
Data Analyst,https://sergievposad.hh.ru/vacancy/31259727?query=python, Авито,"Строить модели поведения пользователей Авито, сегментировать их и выявлять потребности. Продумывать структуру метрик для оценки различных инициатив и проектов, проектировать...Имели опыт работы с BI инструментами, особенно с Tableau. Имеете опыт анализа данных с помощью Python (pandas/numpy/scipy/sklearn). "
"Инженер-разработчик (C/C++, Embedded)",https://sergievposad.hh.ru/vacancy/31917501?query=python, Auriga,"Анализ оценки технических требований и задач. Принятие участия в обсуждении дизайна и требований, а также в принятии решений с инженерами...Опыт использования юнит-тестов. Опыт разработки на Python (будет плюсом). Знание Qt. Разговорный и письменный английский язык (Upper-intermediate). "
Инженер/Архитектор по направлению безопасность веб-приложений (Application Security),https://sergievposad.hh.ru/vacancy/31633001?query=python,ООО SolidLab,"Проработка архитектуры, разработка спецификаций и технических заданий. Эскизное, техническое и рабочее проектирование. Внедрение и настройка технических решений, разработка эксплуатационной документации. Знание языков программирования Bash и Python. Навыки и опыт работы с данными в форматах Syslog, XML, JSON, c реляционными СУБД..."
IP Network Engineer / инженер сети,https://sergievposad.hh.ru/vacancy/31734299?query=python,ООО СИТИК Телеком СПС Рус,"Purpose: Ensuring the flawless operation of the IP network of CITICtelecom to the extent of 99,999% based on a...Related/environmental knowledge and practical experience , such as Linux basics, shell/perl/python scripting/automation, et cetera. High erudition in..."
Ведущий программист C++ (Embedded Linux),https://sergievposad.hh.ru/vacancy/31901290?query=python,АО Эрвиай Групп,"Разработка интеллектуального контроллера. Управление периферией. Разработка механизмов обеспечения отказоустойчивости.Микроконтроллерное программирование (STM). Понимание 485, modbus, OSDP, ONVIF, и т д. Языки автоматизации Lua, Python, Go. Git, Jira. "
Ведущий инженер по тестированию / Senior-Lead QA,https://sergievposad.hh.ru/vacancy/31545128?query=python,ООО БОСТОНДЖИН,"Организация тестирования облачной Платформы BostonGene, участие в разработке Платформы. Проектирование, разработка, внедрение средств автоматизации и фреймворков, интеграция с системами разработки. Глубокое знание технологий и фреймворков тестирования, владение языками программирования (java, python). Опыт работы с СУБД (SQL и NoSQL) в части..."
Unix system administrator/ DevOps (Рига),https://sergievposad.hh.ru/vacancy/31723475?query=python, Bet.tech ,"Оптимизация архитектуры проектов под большие нагрузки. — Исследование новых технологий и их внедрение в существующие проекты. — Сопровождение production и testing окружений. — Что надо уметь и знать: — Опыт работы linux/unix системным администратором от 3-х лет. — Основные дистрибутивы: Debian, Ubuntu. — "
