Название вакансии,URL,Название комании,Описание
Аналитик (Calltracking),https://sergievposad.hh.ru/vacancy/31179101?query=python, Comagic,Проектирование изменений в алгоритме коллтрекинга. Приземление решений бизнес-задач клиентов в команду разработки. Сопровождение выделенной команды разработки. Работа в паре...Математическое образование: в идеале выпускник МФТИ или МГУ. Вы умеете аргументированно обосновывать свою точку зрения. В каких ролях вы могли...
DevOps инженер / администратор облачного сервиса,https://sergievposad.hh.ru/vacancy/29711432?query=python," ОВЕН, Производственное объединение","Мониторинг работы многокомпонентного распределенного сервиса, поддержание работоспособности в режиме 24/7. Выявление аномалий в работе, передача необходимой информации разработчикам. Опыт конфигурирования Nginx/HaProxy/iptables. Опыт написания скриптов на bash/python/php для автоматизации типовых задач. Грамотная устная и письменная..."
Инженер для автоматизации и проведения интеграционно-функционального и нагрузочного тестирования,https://sergievposad.hh.ru/vacancy/29972241?query=python, Diamond Personnel R&C,"Опыт программирования на Java, C#, C++, Python (один из). Опыт работы с bug-tracking системами (Jira, HP ALM). "
Аналитик (Аналитический Отдел),https://sergievposad.hh.ru/vacancy/30585265?query=python, Ингосстрах,"Всесторонняя поддержка департамента продаж в плане предоставления статистической отчетности об эффективности бизнеса, включающая в себя анализ страховой премии, количества заключенных...Опыт работы (желательно в должности аналитика). Знание методов машинного обучения и их применение в статистических пакетах R, Python. "
Аналитик (мобильные продукты),https://sergievposad.hh.ru/vacancy/31448685?query=python, HeadHunter::Технический департамент,"Валидация продуктовых гипотез с помощью А/В тестирования. Развитие собственного фреймворка для проведения регулярных A/B-экспериментов. Развитие experiment-driven......Power BI/Tableau, уверенное использование одного из скриптовых языков, предпочтительно Python). Умение работать с сервисами Google Analytics, Яндекс.Метрика и/или..."
Исследователь-экономист (research analyst in economics),https://sergievposad.hh.ru/vacancy/30995943?query=python, Институт прикладных экономических исследований РАНХиГС при Президенте Российской Федерации,"Выполнение фундаментальных и прикладных экономических исследований, консультационных и информационно-аналитических проектов. Обработка, анализ, систематизация статистических данных. Подготовка аналитических записок, отчётов...Владение современными эконометрическими пакетами (STATA, Eviews, Matlab, SPSS и другие), навыки программирования (Python, R и другие). Умение работать на продвинутом..."
Программист ABAP,https://sergievposad.hh.ru/vacancy/30811581?query=python,ООО Строительный Двор,"поддержка / доработка существующей функциональности (отчеты, печатные формы, user-exit). - поддержка и доработка интерфейсов связи со внешними системами. - участие в разработке...опыт с другими языками программирования (JavaScript/python/java/go). - готовность использовать правила и стиль разработки, который принят в компании. - "
Аналитик,https://sergievposad.hh.ru/vacancy/31907850?query=python, OZON.ru интернет-витрина,"Осуществление аналитической поддержки подразделений компании по запросу руководителя и смежных отделов. Поддержка, разработка и презентация регулярных аналитических отчетов. Дополнительным преимуществом будет знание и владение языками программирования:Python,R,C#,C++,Java,JS. А главное желание учиться и проактивность."
Интеграционный инженер,https://sergievposad.hh.ru/vacancy/30451253?query=python, Открытые Технологии,"Участие в предпроектном обследовании. Разработка проектных решений и написание проектной документации. Установка и настройка ИС. Интеграция ИС с различными источниками...Знания технологий контейнеризации Docker. Опыт в области сетевых технологий. Опыт работы с СУБД (написание SQL-запросов). Python, bash, powershell, JavaScript..."
Программист 1С,https://sergievposad.hh.ru/vacancy/31753020?query=python, 7ЦВЕТОВ,"1С в режиме клиент-сервер (с кластером серверов приложений и несколькими серверами БД). Управляемое приложение, интерфейсы «Такси». MS SQL. Опыт программирования на python или желание получить опыт и знания в этой области. Опыт разработки 1С не менее года. "
Маркетинговый аналитик,https://sergievposad.hh.ru/vacancy/30729008?query=python, Яндекс,"Создать методологию и разработать программу расчета нашего LTV, ROI которая будет учитывать все значимые статьи дохода с пользователя. Отлично владеете SQL. Легко пишете код на Python (NumPy, Pandas, Matplotlib). Знаете основы программирования на Python. Умеете считать метрики eCPI..."
Технический писатель-аналитик,https://sergievposad.hh.ru/vacancy/31910252?query=python, Дизайн-центр цифровой микроэлектроники МГУ имени М.В. Ломоносова,"Подготовка исследовательских разделов научно-технических отчетов по работам проекта. Сравнение наших решений и их компонентов с конкурирующими продуктами CPU/GPU...Внимательность в части подготовки текстов, вижу неясное - разберусь и исправлю. Знание С/С++, Python на уровне ""вижу код, понимаю как..."
Инженер в группу технической поддержки систем хранения данных,https://sergievposad.hh.ru/vacancy/31871199?query=python, Марвел Дистрибуция,"Прием и обработка запросов на поддержку СХД от клиентов компании. Планирование и проведение мероприятий по инсталляции и поддержке оборудования СХД...Знание одного из скриптовых языков программирования (bash, python). Опыт создания систем с высокой нагрузкой. Мобильность, готовность к командировкам. "
Дежурный системный администратор,https://sergievposad.hh.ru/vacancy/29462568?query=python, Яндекс,"Анализировать нештатные ситуации, участвовать в решении проблем на сервисах. Выкладывать программы и разворачивать сервисы на «боевых» серверах. Придумывать и улучшать...Опыт администрирования *NIX-систем не менее 2-х лет. Опыт программирования на Python. Аналитические навыки предотвращения и быстрого устранения неисправностей. "
Product Analyst,https://sergievposad.hh.ru/vacancy/30328377?query=python, Ostrovok.ru,"Проактивное участие в разработке новых функциональных элементов сайта, помощь в создании дизайна и последующий анализ эффективности после внедрения. Очень желательно знание SQL, но, если что, мы научим. Опыт анализа данных средствами Python (предпочтительно) или R. Знание Google Analytics..."
Middle Fullstack Веб Разработчик,https://sergievposad.hh.ru/vacancy/31842145?query=python, Carbon Soft,"Backend разработка веб-служб на Python. Frontend разработка веб-интерфейсов.Любить программирование. Опыт программирования на Python. Знание git или другой системы контроля версий. Опыт работы с HTML, CSS, Vanilla JS..."
Тестировщик ПО (ручное тестирование),https://sergievposad.hh.ru/vacancy/31655518?query=python, Comagic,Тестирование продуктов компании (работа с тест-комплектами): API. Личный кабинет клиента. Ручное (90 %) и автотестирование. Написание тест-кейсов и планов...Знание Unix/Linux-based операционных систем (bash/ssh/ps/grep и т.п.). Знание языка Python. Опыт использования Selenium или...
Инженер телекоммуникаций,https://sergievposad.hh.ru/vacancy/31910647?query=python, ComfortWay,"Поддержание в рабочем состоянии серверов и сервисов компании и их развитие. Настройка и конфигурирование сервисов под нужды клиентов. Администрирование Asterisk и практический опыт настройки SIP-транка. Знания Python, Bash, Docker. Желание расти и развиваться. Опыт работы у оператора..."
Web-программист,https://sergievposad.hh.ru/vacancy/31573798?query=python," ЭЛКОД, группа компаний","Проектирование архитектуры и написание backend части проектов на symfony. Написание Модулей (самостоятельные приложения в рамках общего фреймворка). Поддержка и развитие...Опыт разработки на любом из фреймворков: symfony, yii (symfony - как основной). GraphQL, rest api. Linux. Git. Python. PostgreSQL (знать нормальные..."
Аналитик-разработчик систем управления энергопотреблением,https://sergievposad.hh.ru/vacancy/31903749?query=python,АО НоваВинд,"Разработка, доработка, адаптация и развитие модулей управления накопителями электроэнергии, функционирующими в сети промышленных предприятий. Прогнозирование потребления в масштабах отдельного потребителя...Владение методами линейной оптимизации, статистического анализа, машинного обучения. Уверенное владение языками MatLab / Python. Профессиональный уровень владения Excel. Английский (разговорный и..."
DevOps Engineer (Linux)/Системный администратор (Linux),https://sergievposad.hh.ru/vacancy/31653527?query=python,ООО КРИПТОН,"Внедрение и эксплуатация продукта. Автоматизация процессов непрерывной интеграции продукции и обеспечение бесперебойной работы. Развитие и поддержка системы мониторинга инфраструктуры, анализ...Опыт работы с облачными платформами: AWS, Heroku, Google Cloud. Умение программировать таких языках как python, shell. Понимание принципов проектирования высоконагруженных..."
Менеджер по аналитике (работа с большими данными),https://sergievposad.hh.ru/vacancy/31830450?query=python, Карусель,"Аналитическая поддержка основных направлений бизнеса и разработка предложений по повышению их эффективности. Анализ внутренних показателей деятельности компании, Data mining. Желательно навыки программирования (например, Python), Tableau/Power BI. Аналитический склад ума, пунктуальность, умение работать в стрессовых ситуациях и в условиях..."
Младший системный администратор,https://sergievposad.hh.ru/vacancy/30998292?query=python, PROFI.RU,"С первого дня в офисе включиться в работу команды — писать скрипты, разбираться с проблемами Docker. Простые задачи решать самостоятельно, а...Ты из любопытства или любви к искусству писал несложные программы на одном из этих языков: Python, Perl, PHP, Golang. "
Блокчейн Разработчик,https://sergievposad.hh.ru/vacancy/31853247?query=python,ООО Блокчейнактив,"Участие: Разработка нового протокола с нуля, смарт контракты Ethereum, взаимодействие с топ 10 платформами криптовалют, deploy tendermint + byzantine, STO...Технический английский. Какие навыки желательны? - Опыт разработки на Python или любом другом скриптовом языке программирования. Навыки. Linux, Apache Tomcat, Git..."
"Стажер/ Специалист, Группа оказания услуг организациям финансового сектора",https://sergievposad.hh.ru/vacancy/27552208?query=python, EY (Эрнст энд Янг),Основные направления деятельности: Описание и оптимизация сквозных бизнес-процессов. Анализ бизнес-процессов с целью дальнейшей автоматизации. Разработка нормативной документации. Владение английским языком (upper intermediate). Опыт работы с VISIO/ARIS/R/Python является преимуществом. Примеры выполненных заданий являются дополнительным преимуществом...
Data/ETL разработчик,https://sergievposad.hh.ru/vacancy/31667752?query=python, Anchous Drive Recruitment,"Про компанию и людей: медийный кит с 25 летней историей, миллиардной выручкой, гигантскими планами на изменения и серьезными запросами на...Базовые знания SQL, Python. — Опыт работы с системами контроля версий(Git). — Будет плюсом знание Apache Nifi и Apache Airflow. — "
Системный администратор,https://sergievposad.hh.ru/vacancy/30126154?query=python," ОВЕН, Производственное объединение","Осуществление полного цикла поддержки сервисов компании. Развитие системы сбора, обработки, анализа логов, поиска аномалий. Документационное сопровождение инфраструктуры компании, техническое описание...Специалиста с опытом администрирования Linux (от 3-х лет). Опыт администрирования по следующим направлениям: Приветствуется владение скриптовым языком - Python, Shell..."
Аналитик решений по противодействию мошенничеству,https://sergievposad.hh.ru/vacancy/31319515?query=python, Инфосистемы Джет,"Участие в проектах по внедрению решений по противодействию мошенничеству: обследование бизнес-процессов, выявление потребностей заказчика, разработка технической документации по проекту...Основы программирования, базовые знания одного из языков: Scala / Python / R. Знания в области antifraud в одной из сфер: ритейл, банки..."
Ведущий системный/сетевой администратор,https://sergievposad.hh.ru/vacancy/31780499?query=python,ООО МВС ГРУП,Организация / мониторинг работоспособности сетевой и серверной инфраструктуры. Локализация и разрешение возникающих сбоев в работе сетевой и серверной инфраструктуры. Динамическая маршрутизация. Желательно опыт администрирования ОС Linux (CentOS) и ОС Windows. Приветствуется наличие навыков скриптописания: Python или другой язык. 
Программист / Разработчик С++,https://sergievposad.hh.ru/vacancy/31673354?query=python,АО АСТ,НЕОБХОДИМО:Опыт коллективной разработки приложений (SVN/Mercirial/GIT). Будет преимуществом: Знание языка Python. Знание языка SQL и опыт работы с СУБД.
Performance & reliability engineer,https://sergievposad.hh.ru/vacancy/28677010?query=python,ООО Регистратор доменных имен РЕГ.РУ,"Мониторинг всех возможных показателей скорости, от работы JS на клиенте и рендеринга шаблонов, до выполнения SQL-запросов и отработки заданий...Способен читать и понимать код на любом языке (в основном мы пишем на Perl и Python). Понимаешь основы работы как..."
Middle Automation QA,https://sergievposad.hh.ru/vacancy/31896343?query=python, СТС Медиа,"Разработка автоматизированных тестов (FE, BE, API) и их поддержка. - Оценка трудозатрат на автоматизацию, определение рисков. - Ручное тестирование (от этого не...Уверенное владение языком программирования: Python. - Владение функционалом инструментов автоматизации (Allure, Pytest). - Опыт автоматизации тестирования или разработки ПО. - Опыт ручного тестирования. - "
Ведущий инженер,https://sergievposad.hh.ru/vacancy/31794573?query=python, Сбербанк для экспертов,"Организация репликации и балансировки сервисов RH IDM (FreeIPA). Управление жизненным циклом сертификатов. Работа с системами авторизации Apache Sentry, Apache Ranger. Уверенное владение инструментарием автоматизации рутинных действий (bash, python, ansible). Важно понимание работы Kerberos. Понимание механизмов организации DevOps pipeline. "
Системный аналитик (АС СП),https://sergievposad.hh.ru/vacancy/31862507?query=python, Сбербанк для экспертов,Проведение приемо-сдаточных испытаний. Написание тестовых сценариев для команды тестирования. Помощь в решении ошибок и сопровождении продуктов / рабочих процессов. Опыт разработки ПО на Oracle обязателен. Опыт написания и оптимизации SQL запросов. Умение работать с функциональными и техническими требованиями.
Системный аналитик (АС СП),https://sergievposad.hh.ru/vacancy/31862985?query=python, Сбербанк для экспертов,Проведение приемо-сдаточных испытаний. Написание тестовых сценариев для команды тестирования. Помощь в решении ошибок и сопровождении продуктов / рабочих процессов. Опыт разработки ПО на Oracle обязателен. Опыт написания и оптимизации SQL запросов. Умение работать с функциональными и техническими требованиями.
Middle С++ developer (Программист С++),https://sergievposad.hh.ru/vacancy/31235433?query=python, Адалиск,"Разрабатывать CAD систему. Разрабатывать систему автоматической проверки качества выпускаемых организацией продуктов.Умение писать «отказоустойчивый» код. Опыт использования Python или стойкая готовность его изучить. Знание английского языка на уровне, необходимом для ведения..."
Ведущий инженер,https://sergievposad.hh.ru/vacancy/31794009?query=python, Сбербанк для экспертов,"Организация репликации и балансировки сервисов RH IDM (FreeIPA). Управление жизненным циклом сертификатов. Работа с системами авторизации Apache Sentry, Apache Ranger. Уверенное владение инструментарием автоматизации рутинных действий (bash, python, ansible). Важно понимание работы Kerberos. Понимание механизмов организации DevOps pipeline. "
