Название вакансии,URL,Название комании,Описание
Разработчик С,https://sergievposad.hh.ru/vacancy/31690310?query=python,ОАО ИнфоТеКС,"Разработка на С для Embedded Linux систем. Программирование DSP процессоров для обработки видеоизображения. Поддержка и развитие ПО.Опыт разработки на С под linux. Навыки программирования на С++ и Python. Базовые знания алгоритмов цифрового видеоизображения, программировании DSP процессоров. "
QA Auto developer (Verticals),https://sergievposad.hh.ru/vacancy/31805877?query=python, Авито,"обеспечивать качество продукта на всех этапах разработки, от постановки задачи до выкатки в production. - внедрять лучшие практики контроля и обеспечения...уверенно пишете код на одном из языков: Kotlin, PHP, Go, Python, Java. - имеете опыт поддержки и разработки инфраструктуры автоматизированного тестирования. - "
Optical engineer (Developing complex optical systems),https://sergievposad.hh.ru/vacancy/30790005?query=python, Samsung Research Center,"Nanostructured materials. Design and assembling complex optical systems (off-the-shelf components). Programming: General: Simulations and CAD systems (Zemax, Light...Education in Optics or physics (PhD or PhD candidate as a plus). Optics: Proficiency in optical instrumentation (including modalities) and..."
Разработчик Java,https://sergievposad.hh.ru/vacancy/30451490?query=python, Открытые Технологии,"Реализация нового функционала. Проведение code-review. Анализ чужого кода. Участие в проектировании архитектуры системы.Опыт программирования на Java/Scala/ опционально Python. Знание Java core (Collections, I/O, Concurrent). Знания стека технологий EE (Servlets, JMS..."
Ведущий разработчик/TeamLead (системный архитектор),https://sergievposad.hh.ru/vacancy/31163730?query=python,АО ПроРеск Сервис,"Разработка целевой архитектуры ИС и интеграционных решений, исследование и оценка перспектив использования новых технологий, обоснование выбора стека технологий. Рассматриваемый стек технологий: React/Angular, Node.js /Python/Go, MySQL/MariaDB/PostrgeSQL. Знание современных методик командной разработки, управления проектами (работаем по..."
Senior Backend developer,https://sergievposad.hh.ru/vacancy/30818017?query=python, Star-staff,"Platform: Docker, Debian. Frontend: Javascript, WebGL, Webpack, React. Опыт проектирования API. Опыт использования Docker. Дополнительным плюсом будет: Опыт проектирования микросервисных..."
Senior Release Engineer,https://sergievposad.hh.ru/vacancy/31311325?query=python, OZON.ru Разработка,"Разработка процессов CI\CD и их автоматизация. Интеграция процессов разработки, тестирования и эксплуатации. Участие в настройке инфраструктуры.Знаете Linux, Bash, Git, GitLab. Имеете опыт программирования на Python, Go, C#, Java. Имеете опыт организации процессов CI/CD. "
PHP-разработчик,https://sergievposad.hh.ru/vacancy/31277889?query=python, Финансовый университет при Правительстве РФ,"Поддержка и сопровождение информационных систем на базе веб технологий. Доработка и модификация отчетных и печатных форм, разработка новых. Английский язык - чтение технической документации. Опыт разработки веб-сервисов на PHP, PYTHON и HTML5 без применения фреймворков (знание фреймворков..."
Optical Engineer (small sized optical sensors),https://sergievposad.hh.ru/vacancy/31859025?query=python, Samsung Research Center,"Candidate successfully passed the selection procedures will carry out optical designs, including calculations and simulations of complex optical layouts, estimate...Understanding of optical elements manufacturing and fabrication processes. Optomechnics: - Proficiency in at least one of CAD systems (Solid Works, Autocad..."
Андроид разработчик,https://sergievposad.hh.ru/vacancy/31802459?query=python,ООО Хидбук Клауд,"Добавление инноваций в текущие и новые мобильные продукты Heedbook. Участие в проектировании и реализации протоколов взаимодействия с сервисами Heedbook. Опыт code-review (контроль качества кода). Опыт разработки серверных приложений (Java, Scala, Python). Опыт работы с БД (PortgreSQL, SQLite). "
Разработчик BI,https://sergievposad.hh.ru/vacancy/31816447?query=python, OZON.ru Разработка,"Участие в миграции с пратформы Microsoft на Vertica и дальнейшее развитие аналитической системы. Анализ требований внутренних заказчиков, разработка и согласование...Знание стека технологий Microsoft: SQL Server, SSIS, SSAS, SSRS. Обязательное знание языка Python для разработки ETL. Опыт работы с СУБД..."
Менеджер проектов,https://sergievposad.hh.ru/vacancy/31829291?query=python,ООО РАБЛЗ,"Выстраивание прозрачного эффективного процесса между внутренними командами (в первую очередь, разработки и анализа данных) и командой со стороны заказчика. Желательно базовое знание хотя бы одного из языков программирования (например, Python или Java). Желание развиваться в сферах fintech и/или..."
Разработчик автотестов,https://sergievposad.hh.ru/vacancy/28583677?query=python,ООО АТОН,"Выбор стратегии покрытия функционала автотестами. Разработка автотестов для backend-а мобильного приложения (REST-API) и выбор подходящих технологий, инструментов. Опыт разработки на платформе Java > 1 года. Желателен опыт разработки на языке Python. Хорошее знание SQL. Знание основных подходов к..."
Программист PostgreSQL (PL/PGSQL),https://sergievposad.hh.ru/vacancy/25944643?query=python,ООО Интегратор ИТ,"Разработка и сопровождение серверной части CRM системы, включая проектирование модели данных, создание объектов БД. Создание хранимых серверных процедур БД для......СУБД Oracle (знание PL/SQL). Опыт работы с git или другой системой контроля версий. Плюсом будет знание FastReport, JasperReports, Python."
Тестировщик,https://sergievposad.hh.ru/vacancy/31310374?query=python, IBS,"Разработка функциональных тестов в соотвествии с тербованиями к ПО. Разработка фреймфорка для интеграционного тестирования продуктов, использующих ADCM, в качестве управляющего...Минимальные знания Python или знание PHP/Java/Ruby и желание Python изучать. Знакомство с Unit тестированием. Знание Selenium - желательно. "
"Экономист-математик (IO, эконометрика/data science)",https://sergievposad.hh.ru/vacancy/31258061?query=python, Институт прикладных экономических исследований РАНХиГС при Президенте Российской Федерации,"Построением отраслевых и межотраслевых экономических моделей. Сбором и анализом неформализованных данных из разнообразных источников. Разработкой и сопровождением экономических информационных систем. Свободное чтение профессиональной и научно-технической литературы на английском языке. Навыки программирования (R, Python) и работы с базами данных. "
Программист,https://sergievposad.hh.ru/vacancy/31857201?query=python,ООО Строительный Двор,"поддержка / доработка существующей функциональности (отчеты, печатные формы, user-exit). - поддержка и доработка интерфейсов связи со внешними системами. - участие в разработке...желание изучать ABAP. - опыт с другими языками программирования (JavaScript/python/java/go/C#). - английский язык на уровне чтения и понимания..."
Инженер DevOps,https://sergievposad.hh.ru/vacancy/29323686?query=python, Новые Облачные Технологии,"Писать: Скрипты автоматизации на bash/python. Dockerfile'ы разрабатываемых систем. Небольшие вспомогательные сервисы на python/go. Роли и сценарии на...Ansible. Jenkins + Pipeline. Git/gitlab. Навыки автоматизации работы: Bash/python. Postfix. DNS, и, в частности, SPF/DKIM. "
Системный программист,https://sergievposad.hh.ru/vacancy/31242455?query=python, ГК «ХайТэк»,Разработка оптимизирующего компилятора для создания кода выполнения моделей нейронных сетей(Tensorflow/PyTorch) на тензорном микропроцессоре. Разработка методов разработки разбиения графов...Опыт разработки оптимизирующих компиляторов. Высокий уровень знания C++. Высокий уровень знания Python. Опыт работы со стеком LLVM. Опыт работы с...
Инженер-программист,https://sergievposad.hh.ru/vacancy/27881456?query=python, Либхерр-Русланд,"Деятельность по разработке программного обеспечения: - Разработка требований к программному обеспечению. - Создание программного дизайна (UML). - Написание исходного кода (C, языки программирования...Преимущественные способности включают: - Знание UML инструментов и методов. - Знание языка программирования Python. - Опыт проектирования аппаратно-программируемых логических устройств и языка..."
Backend developer (Java),https://sergievposad.hh.ru/vacancy/28657771?query=python,ООО Обоз,"Разработка Backend функционала для логистического онлайн сервиса. Используемые технологии: Java (Spring), PostgreSQL, GitLab, CI/CD, Docker, Ruby, Python, Kotlin, ELK...Опыт написания функциональных и юнит тестов. Приветствуется: Знание скриптовых языков (bash; как преимущество python или ruby), умение писать сложные SQL..."
Data scientist (deep research),https://sergievposad.hh.ru/vacancy/31656145?query=python, WorldQuant,Enriching a wide range of large structured and unstructured data into datasets for quantitative analysis. Enhancing data quality & integrity via...Expertise in time series analysis and models. Confidence with Python and a prior experience or the ability and willingness to...
Системный аналитик,https://sergievposad.hh.ru/vacancy/31432423?query=python, Росгосстрах,"Описание интеграционных потоков между информационными системами. Формирование требований к интеграционным сервисам в части логирования операций. Ведение справочника бизнес-операций. Понимание XML, XSD, JSON, WSDL. Приветствуется знание Python, Java, JavaScript, PHP, HTML, IBM WebSphere MQ, Oracle PL/SQL, Splunk. "
Специалист по тестированию (mobile),https://sergievposad.hh.ru/vacancy/31633424?query=python, OZON.ru Тестирование,Тестировать и своевременно находить неисправности приложения. Разрабатывать и поддерживать в актуальном состоянии тестовую документацию. Проводить различные виды ручного тестирования – регрессионное...Умение грамотно и понятно писать тест-кейсы. Хорошее знание теоретической части тестирования. Понимание принципов работы мобильных устройств. Опыт тестирования API. 
Senior PHP developer,https://sergievposad.hh.ru/vacancy/31408358?query=python, retailCRM,"Разрабатывать сервисы под очень большую нагрузку. Проектировать и совершенствовать дизайн сервисов. Планировать работы, оценивать задачи. Писать тесты для своих решений. Опыт программирования на одном из языков Go, PHP, Python, Javascript от 3 лет, знать сильные и слабые стороны языка и..."
BI Аналитик,https://sergievposad.hh.ru/vacancy/31846501?query=python, Авито,"Любознательны, умеете договариваться. Умеете видеть проблему или систему со стороны бизнеса, проактивно способствовать повышению эффективности. Владеете методиками анализа данных, используя...Имели опыт работы с BI инструментами, особенно с Tableau. Имеете опыт анализа данных с помощью Python (pandas/numpy/scipy/sklearn). "
Ведущий разработчик Ruby on Rails,https://sergievposad.hh.ru/vacancy/27403045?query=python,ООО «Баланс-Платформа»,"Продумывать и реализовывать архитектуру нескольких проектов, определять технологический вектор развития проектов. Осуществлять код-ревью. Front-часть на React, которой занимается...Декомпозировать и ставить задачи разработчикам, оценивать сроки. Имеете большой и крутой опыт работы с Ruby on Rails/PostgreSQL. "
DevOps инженер,https://sergievposad.hh.ru/vacancy/30659322?query=python, НИИ «Восход»,"Администрирование Linux-инфраструктуры (CentOS и RHEL 6\7). Разбор инцидентов (просмотр логов, поиск решений). Настройка, оптимизация прикладного ПО (как правило...Опыт администрирования Linux (CentOS, RedHat). Знание скриптовых языков (bash и\или python). Уверенные знания anisble. Опыт работы с java технологиями..."
Разработчик сайтов (удалённая работа),https://sergievposad.hh.ru/vacancy/31478307?query=python,ЗАО КонсультантПлюс,"Переработка и развитие высоконагруженного сайта, содержащего правовую информацию. Объём задач: front end, back end, HTML-вёрстка. Разработка алгоритмов и средств...Опыт в области разработки/переработки высоконагруженных сайтов от 3 лет. Профессиональное владение Python и/или С# (желательно предоставить примеры из..."
QA Lead,https://sergievposad.hh.ru/vacancy/31885725?query=python, Lamoda,"Управление командой тестирования. Планирование и проведение тестирования. Построение системы Continuous Integration. Проектирование, дизайн и программирование автотестов. Участие в разработке автоматизированной...Опыт в разработке автотестов. Навыки в функциональном тестировании. Навыки тест-менеджмента - приоритизация, оценка покрытия. Общее представление о процессе разработки ПО. "
Full Stack Разработчик,https://sergievposad.hh.ru/vacancy/31477365?query=python, Blackmoon,"Разработкой и развитием сайта gramvault.com. Реализацией торговых пользовательских интерфейсов. PostgreSQL: структура БД и нормальные формы/денормализация, индексы, оптимизация. Опыт разработки на Go от 2 лет. Теоретическую базу (алгоритмы, паттерны проектирования, ООП). Понимание паттернов Service-Oriented Architecture и Microservice. "
Аналитик данных,https://sergievposad.hh.ru/vacancy/31474673?query=python," АТОЛ, группа компаний","Формирование выборок по заданным критериям. Формирование аналитической отчетности. Поиск инсайтов в данных. Подготовка метрик на основе данных. Визуализация данных в......sql, python/r. Опыт работы с существенными объемами данных (100-ни Гбайт). Близкий к нам стек (Spark (sql, scala), Python..."
DevOps разработчик / Разработчик бандлов,https://sergievposad.hh.ru/vacancy/31841655?query=python, IBS,"Активно участвовать в разработке, развитии и поддержке системы управления развертыванием Big Data сервисов (Hadoop, Clickhouse, Greenplum). Работать c системой отслеживания...Опыт работы со стеком Hadoop. Опыт работы со Clickhouse. Опыт работы со Greenplum. Опыт сопровождения IT-инфраструктуры. Знание Python."
Системный администратор Linux (эксплуатация),https://sergievposad.hh.ru/vacancy/30643054?query=python, .masterhost,"Развертывание, настройка и администрирование серверов под управлением Linux. Мониторинг работы программного и аппаратного обеспечения серверов и оперативное решение возникающих проблем...Умение разобраться в коде на одном из языков - Bash, Python, Perl, PHP. Опыт администрирования БД MySQL, написания SQL-запросов. "
Аналитик-тестировщик,https://sergievposad.hh.ru/vacancy/28245570?query=python,ЗАО КонсультантПлюс,"Анализ предметной области с целью выявления направлений развития программных продуктов. Разработка и экспертная оценка технических заданий. Ручное и автоматизированное тестирование...Высшее техническое или физико-математическое образование обязательно. Опыт программирования (желательно знание С#, Python) от 2 лет. Опыт настройки и администрирования..."
DevOps инженер,https://sergievposad.hh.ru/vacancy/31844111?query=python,ООО Регистратор доменных имен РЕГ.РУ,Развитие и автоматизации инфраструктуры. Взаимодействие с командой разработки. Расширять мониторинг сервисов. Изучать и внедрять новые инструменты. Доработка существующих инструментов. Понимание архитектуры современных web-сервисов. Опыт работы с микросервисной архитектурой. Знание bash/Python на уровне написания скриптов для оптимизации работы.
DevOps specialist,https://sergievposad.hh.ru/vacancy/31820766?query=python, Lamoda,"...с помощью Ansible, Bamboo. DevOps, разработка архитектуры, автоматизация развертыванию, настройка и обслуживание сервисов собственной разработки (Scala, Python) - Ansible, Docker, Bamboo.Опыт работы с системами Configuration Management: ansible. Опыт работы с системами Continuous Integration, Continuous Deployment. Опыт написания скриптов (BASH, Python..."
Аналитик BI,https://sergievposad.hh.ru/vacancy/29845187?query=python, TalentTech,"Разработкой отчетов и дашбордов в системе Tableau. Сбором и анализом данных из различных источников (БД, текстовые логи и тд.). Навыки интерпретации, визуализации и презентации данных. Английский на уровне чтения документации. Знание Python или иного скриптового языка. Понимание теории вероятностей."
Computer Vision разработчик,https://sergievposad.hh.ru/vacancy/31485113?query=python, Cognitive Technologies,"Детектирование границы скошенной части поля (для автоматического подруливания зерноуборочного комбайна). Детектирование положения железнодорожной стрелки или семафора (для повышения безопасности маневрового...Уверенное знание C++. Знание Python, достаточное для прототипирования алгоритмов. Знание основных понятий и методов машинного обучения. Опыт работы с CUDA. "
