Название вакансии,URL,Название комании,Описание
Python Developer,https://sergievposad.hh.ru/vacancy/31550822?query=python, LLC ICONIC,Разработка web сервисов на протоколе GraphQL. Разработка микросервисов. Интеграции с blockchain нодами.Опыт коммерческой разработки от 4х лет. Опыт разработки на Python 3 не менее 3 лет (желательно на версии выше...
Разработчик Python,https://sergievposad.hh.ru/vacancy/31624245?query=python,ОАО Оператор систем пенсионного обеспечения и страхования,"Проектирование и разработка backend - сервисов на языке Python. Написание unit-тестов. - понимание смежных областей разработки ПО (управление, анализ требований, проектирование...Отличные знания Python 3. Владение общими вопросами программирования: шаблоны проектирования, структуры данных, алгоритмы. Опыт использования систем контроля версий. "
Data Engineering Team Lead (Python / C++),https://sergievposad.hh.ru/vacancy/31522998?query=python, DataFork,"Автоматизация процессов сбора, хранения и анализа данных из открытых и закрытых источников (ETL / CMC). Автоматизация процессов обработки, «обогащения» и нормализации...Умение читать / писать код на python и С++. Опыт разработки в среде linux. Опыт руководства командой 3-5 человек. "
Разработчик Python,https://sergievposad.hh.ru/vacancy/30451399?query=python, Открытые Технологии,"Реализация нового функционала. Проведение code-review. Анализ чужого кода. Участие в проектировании архитектуры системы.Знание языка Python (версия 2 и 3). Опыт работы с фреймворками: Tornado (async), Flask, Bottle. Опыт написания SQL запросов. "
Разработчик Python,https://sergievposad.hh.ru/vacancy/31194079?query=python,ООО «Баланс-Платформа»,"Реализация банковских продуктов на языке Python (у нас версия 3+). Участие в построении технической архитектуры крупного проекта, выработка решений...Опыт программирования на Python 2-х лет и знание его экосистемы. Опыт проектирования и реализации (хотя бы в составе команды..."
Разработчик Python,https://sergievposad.hh.ru/vacancy/31617755?query=python, NAJET,"Работа по ТЗ в составе группы участников. Качественная разработка и отладка программного кода. Качественное внедрение проектов.Знание языка Python (версия 3/2). Опыт работы с фреймворками: Tornado (async), Flask, Django. Опыт написания SQL запросов. "
Программист Python,https://sergievposad.hh.ru/vacancy/31445859?query=python,ООО ВойсЛинк,"Разработка программного обеспечения встраиваемых систем под Linux и десктопных приложений под Windows. Поддержка кода, написание сопроводительной документации.Опыт коммерческой разработки на Python от 2-х лет. Умение проверять свой код. Опыт работы с реляционными базами данных. "
Python разработчик,https://sergievposad.hh.ru/vacancy/27367094?query=python, Group-IB,"Разработка бекэнд-части веб-приложений на языке Python (DJango framework). Проектирование и реализация API разрабатываемых систем. Документирование разрабатываемых AP. Законченное высшее образование в техническом вузе. Хороший опыт программирования на Python, понимание концепций языка и Python way. Опыт написания модулей..."
Разработчик Python,https://sergievposad.hh.ru/vacancy/31510743?query=python,ООО СФ Лабс,"Проектирование и реализация веб и API-сервисов. Работа над веб-приложениями: доработка существующих и написание новых. Ожидается высокая самостоятельность в...Опыт проектирования и реализации веб-сервисов с нуля. Отличное знание Python 3, Django (включая ORM). Опыт работы с HTML/CSS..."
Python разработчик,https://sergievposad.hh.ru/vacancy/31816890?query=python,ООО ЗОЖ,Разработка новых и развитие существующих сервисов нашей платежной системы.Уверенное знание python 3x. Опыт работы с asyncio или tornado. Уверенное знание SQL. Умение работать с git. 
Python Web Developer,https://sergievposad.hh.ru/vacancy/31433957?query=python, Soshace,Do you have more than 3-year commercial experience in web development on projects with Python? Do you have 1...
Разработчик Python,https://sergievposad.hh.ru/vacancy/31566378?query=python, Веб Контроль,"Разработка сервисов для поддержки поиска, идентификации и удаления нелегального контента в Интернете. Интеграция с существующими программными продуктами, их развитие и...Высшее техническое образование. Отличное знание и опыт разработки на Python, Django. Опыт работы с очередями сообщений (RabbitMQ). Опыт работы с..."
Разработчик Python,https://sergievposad.hh.ru/vacancy/31814809?query=python,ООО АТФ,"Разработка с “нуля” системы. Разработка и поддержка “умных” high load сервисов на основе алгоритмов машинного обучения (в частности, систем рекомендаций...Широкий опыт разработки на Python (2.x, 3.x) управление зависимостями (pip/easyinstall), pandas, numpy, sklearn, seaborn. Знание tensorflow или..."
Python developer / Python разработчик,https://sergievposad.hh.ru/vacancy/30047806?query=python, TalentTech,"Разработкой новых и поддержкой существующих сервисов компании. Участвовать в разработке архитектуры продуктов. Разработкой новых микросервисов.Владение языком Python на уровне не ниже middle. Способность работать как в команде, так и не бояться проявить инициативу, принимая..."
Python - разработчик,https://sergievposad.hh.ru/vacancy/31891911?query=python, Bravelife,Разработка back-end части на Django (и Aiohttp). Разработка архитектуры проектов и отдельных компонент. Развитие инфраструктуры.Опыт разработки на Python от 3х лет. Базовые знания Linux. Понимание принципов работы БД (Postgres). Знание основных паттернов проектирования. 
Python Data Scientist,https://sergievposad.hh.ru/vacancy/31554742?query=python, Web Interactive World,"Работа с большими объемами структурированных и неструктурированных данных. Подготовка данных, выявление закономерностей на признаках, feature engineering. Построение, оценка и внедрение...Хорошая математическая подготовка, владение основами статистики, умение объяснить и доказать полученный результат. Отличное владение Python и ML-стеком (statsmodels, sklearn..."
Программист Python,https://sergievposad.hh.ru/vacancy/31733833?query=python,ООО ФИНКЕЙС,Разработка приложений с описанным стеком технологий (в основном back end (90%)). Привлечение к работе во front (мелкие правки в случае...Опыт разработки Python + Flask (знание Django будет плюсом). Отличные знания основных библиотек Python. Умение писать sql запросы. 
Ведущий разработчик Python,https://sergievposad.hh.ru/vacancy/31911539?query=python,ООО ИЦ АЙ-ТЕКО,"Разработка back – сервисов на NLP – платформе Банка. - Реализация механизмов интеграции с внешними системами. - Подготовка данных для обучения моделей. - умение профилировать и оптимизировать код на Python. -опыт в Data Science, в т.ч. решения NLP задач. -знание / опыт работы..."
Программист Python,https://sergievposad.hh.ru/vacancy/31916720?query=python,ООО Альфред,"Развивать CRM системы компании. Заниматься регулярной оптимизацией процессов. Составлять аналитические отчеты. Взаимодействовать с отделами маркетинга и Client Service.Работает с Python от 3 лет: asyncio, tornado. Знает базы данных: реляционные и нереляционные (Postgres, SQLAlchemy, Mongodb, Elasticsearch). "
Программист Python,https://sergievposad.hh.ru/vacancy/31419111?query=python, Inline Telecom Solutions,"Web-разработка. Разработка систем сбора и анализа данных для веб-маркетинга, систем анализа сетевой активности, учета ресурсов. Поддержка и развитие...Хороший опыт и знания работы на Python. Опыт веб-разработки с использованием Django. Навыки работы с SQL. Опыт разработки ПО..."
Junior Data Developer (Python),https://sergievposad.hh.ru/vacancy/31523007?query=python, DataFork,"Автоматизация процессов сбора, хранения и анализа данных из открытых и закрытых источников (ETL / CMC). Автоматизация процессов обработки, «обогащения» и нормализации...Уверенное владение python (3.*). Опыт разработки в среде linux. Высшее техническое образование. Опыт работы с библиотекой pandas. Владение С++ и..."
Программист C++/Python,https://sergievposad.hh.ru/vacancy/31708292?query=python,АО Интегрис,"Разработка алгоритмов для интеллектуальных транспортных систем. Анализ точности и потенциала прототипов. Реализация и оптимизация алгоритмов (компьютерное зрение, машинное обучение). Опыт работы программистом С++ или программистом-исследователем Python. Умение и желание разбираться в чужом коде. Знание базовых библиотек python как..."
Python-разработчик распределенной вычислительной системы,https://sergievposad.hh.ru/vacancy/31441611?query=python,ООО БОСТОНДЖИН,Анализ генетических данных пациента — основной инструмент для получения информации о заболевании и разработки персонализированного плана лечения. Современные методы секвенирования позволяют...Опыт разработки на Python от 1 года. Опыт построения и масштабирования веб-приложений на Python. Понимание базовых принципов построения распределенных...
"Full-stack разработчик (Python, JavaScript)",https://sergievposad.hh.ru/vacancy/29195763?query=python, LiteBox,"Активно участвовать во всех этапах разработки в составе Scrum-команды: от сбора и анализа требований до написания кода и выкатки...Отличное знание Python. Владение технологиями: HTML, CSS, JavaScript (jQuery). Понимание веб-стека, принципов REST и построения реляционных моделей данных. "
Python/Django разработчик,https://sergievposad.hh.ru/vacancy/31406169?query=python,ООО ИДАГРУПП,Разработка и проектирование проекта от идеи до воплощения. Поддержка существующих проектов и разработка новых.Знание Python 3.6+. Соблюдение PEP8. Уверенное знание Django 1.11+. Работа со стэком Celery / RabbitMQ. 
Python developer (Cloud Services),https://sergievposad.hh.ru/vacancy/31418541?query=python, IVIDEON,"Вместе с нами будут разрабатывать бекенд Ivideon. Проектировать архитектуру новых сервисов. Автотестить написанное - сейчас код покрыт 800 функциональными тестами. Опыт командной разработки. Желательно Python (писать нужно будет в основном на нём), но бэкграунд в Go/C++/Java тоже может..."
Разработчик Python,https://sergievposad.hh.ru/vacancy/31432060?query=python, GlobalCareer,"Основные задачи: Поддержка и развитие существующих инструментов мониторинга (сетевое приложение-прокси для Zabbix на Python 3.5+, asyncio). Понимание принципов asyncio, мультитрединга и мультипроцессинга (используется в скриптах автоматизации). Опыт в рефакторинге, декомпозиции, построении модульных приложений. Умение отлаживать асинхронный..."
Программист Python,https://sergievposad.hh.ru/vacancy/31651569?query=python," Insilico Medicine, Inc",Алгоритмическая подготовка.Техническое образование или эквивалентный практический опыт. Хороший опыт разработки на Python. Опыт разработки веб-приложений.
Ведущий разработчик C++/Python,https://sergievposad.hh.ru/vacancy/31904629?query=python, СОВЕТСКАЯ АПТЕКА,"...для аптечной сети на C++ с использованием встраиваемых скриптов на Python. Обязательное регламентное обновление модулей системы: новые отчеты, улучшение интерфейса...Высшее техническое образование. Опыт разработки программ автоматизации торговли и склада. Понимание принципов ООП - хорошее знание С++ / Python. Навыки построения пользовательского..."
Программист Python,https://sergievposad.hh.ru/vacancy/31891565?query=python, RU-CENTER Group,"Магазин доменов - сервис продажи доменов на вторичном рынке. Умный подбор доменных имён для главного сайта компании. Stand alone web-приложение...Знание python (версия 3). Знание django, django orm и django rest framework (опыт реализации 2-3 API на django rest..."
Senior программист Python,https://sergievposad.hh.ru/vacancy/30567902?query=python,ООО Строительный Двор,"качественное и своевременное исполнение задач web-проекта и непосредственного руководителя. - поддержка и доработка уже существующих сайтов. - разработка концепции развития веб...опыт работы от 4+ года в разработке Python, или других языках. - опыт разработки на языках программирования JAVA и PYTHON..."
"Программист Python (Junior, Middle)",https://sergievposad.hh.ru/vacancy/31538442?query=python,ООО ЛЛЛ ТЕХНОЛОДЖИЗ,"Опыт оптимизации программ на C/C++/Python, замеров метрик производительности; знакомство с инструментарием для этого. Желание разбираться в финансовой индустрии..."
Python developer,https://sergievposad.hh.ru/vacancy/30005963?query=python, NetworkOptix,"Продукт — система видеонаблюдения NX Witness — кроссплатформенный коробочный продукт, работающий распределенно в сетях. Тесты — Python-проект для работы с виртуальными машинами...Умение и опыт работы в команде. Уверенные знания Python. Опыт разработки под Linux, знание командной строки Linux. Наличие примеров кода. "
Программист Python,https://sergievposad.hh.ru/vacancy/31593844?query=python,ООО АйПи Видео Системс,Разрабатывать программное обеспечение и сервисы.Понимание алгоритмов и структур данных. Отличное знание и опыт использования Python 3. Знание основных сетевых протоколов. Опыт создания многопоточных приложений. 
Разработчик Python/Django + React.js,https://sergievposad.hh.ru/vacancy/31844761?query=python, Ivelum,"Это вакансия для фуллстек-разработчиков уровня ""middle"" или ""senior"". Мы ожидаем, что у вас уже есть опыт в веб-разработке..."
Ведущий разработчик Python на платежную платформу,https://sergievposad.hh.ru/vacancy/31705453?query=python,ИП Новикова Ольга Станиславовна,"Принятие на поддержку существующего финтех проекта, дальнейшее его развитие (интеграции, доп.функционал и тд).Опыт разработки и поддержки крупных коммерческих проектов, реализованных на Python (Django) от 3х лет. Знание тонких мест реализации фреймворка..."
Python Developer,https://sergievposad.hh.ru/vacancy/31647306?query=python,ООО Хантфлоу,"Уровень сложности повышает и большое число внешних интеграций: с джоб-сайтами, соцсетями, СМС-операторами, телефонией, почтой, календарями и многим другим. Разработчика с опытом в асинхронном программировании от 2 лет, который работал с микросервисами, ORM (pewee), проектировал HTTP REST API."
Разработчик Python,https://sergievposad.hh.ru/vacancy/31605016?query=python, ГК «ХайТэк»,Разработка и тестирование модулей Python для поддержки запуска нейронных сетей на тензорном процессоре. Участие в тестировании разработанных модулей микропроцессора. Опыт промышленной разработки на Python. Мы используем Python 3. Знание и умение применять на практике системы тестирования кода. 
"Senior python developer в Трипстер (Python, Django, Celery, Redis, Elasticsearch)",https://sergievposad.hh.ru/vacancy/31484508?query=python, Трипстер,"Что используем. Redis для сбора статистики. Nginx + uwsgi. Sentry для сбора ошибок. New Relic для мониторинга.Отличные знания Python, Django, MySQL (транзакции и оптимизация запросов), опыт работы с Elasticsearch. Базовый опыт работы с Javascript, чем-нибудь..."
"Full-Stack разработчик (Python, React)",https://sergievposad.hh.ru/vacancy/31715099?query=python," Mail.Ru Group, Другое",Разработка новых и развитие существующих внутренних инструментов и корпоративных сервисов. Автоматизация процессов от разработки до кадровых. Активное участие в проектировании...Опыт работы с React.js. Опыт работы с Djangо.
Python-разработчик,https://sergievposad.hh.ru/vacancy/31748373?query=python, Uchi.ru,"Разработка микросервисов для работы алгоритмов машинного обучения в продакшене. - Создание инфраструктуры для процессинга данных. - Метрики/мониторинг - prometheus, grafana.Что мы хотим видеть в сотруднике: Уверенное владение: - Python3. - SQL (предпочтительно Postgres). - Web-фреймворк (Django - предпочтительно, Flask). - "
"Ведущий специалист / data scientist (big data, прогностическая аналитика, data mining)",https://sergievposad.hh.ru/vacancy/29632581?query=python,ЗАО Прогностические решения,Участие в проектах по созданию и внедрению аналитических систем и решений. Основные этапы проектов:Желательны навыки владения программным обеспечением IBM SPSS Modeler или аналогичным программным обеспечением обязательно. Желательны навыки владения Python и / или R.
Программист Python (Middle),https://sergievposad.hh.ru/vacancy/31668314?query=python,ООО Контент лайн,"Разработка, code review и рефакторинг систем. Участие в проектировании систем. Сопровождение и документирование проектов.Уверенное знание Python 2 и 3. Уверенное знание Django 1.8+ и популярных пакетов для него. Знание SQL и..."
Python-разработчик,https://sergievposad.hh.ru/vacancy/31508224?query=python,ООО КГК,Разработка архитектуры новых приложений. Разработка GUI приложения на Python для внутреннего использования. Управление задач и документирование осуществляется в JIRA и...Знание Go. Опыт работы с Tornado.
